Start Time,End Time,Text
1594.6200000000001,1601.2600000000002,our code without uh oops did i do it twice sorry yes i did let me just comment one of these out
1602.8600000000001,1611.74,oops there so how do i add the piece about values yes
1611.74,1629.66,yep so we can pop this into a try and then accept and raise value error yep and with some nice
1629.66,1633.02,message here nice message
1636.86,1641.5,and we can also put the entire for loop under the try the code is not very long that it does
1641.82,1646.78,it wouldn't make a difference right so if we try to run it like that now i've got my value
1646.78,1654.46,error with my nice message another uh yeah another way we could raise the value error just for
1654.46,1659.82,completion sake is to say something like you can even raise things inside if statements they don't
1659.82,1666.06,have to be part of accept blocks before we even do anything with the code we can say if zero is in
1666.06,1676.7,l denom raise value error that would also be a fine thing to do okay so we can raise values wherever
1676.7,1684.54,we'd like so now i'd like to talk a little bit about assertions so assertions are actually still
1684.54,1691.58,exceptions that get raised they're just a very special type of uh exceptions that we mostly use
1691.58,1699.26,as a defensive programming tool so assertions are basically used to enforce these
1699.26,1704.62,contracts that we make between somebody who writes a function and somebody who uses a function
1704.62,1709.8999999999999,so that's basically the function dog strings right when we talked about dog strings i said that
1709.8999999999999,1717.4199999999998,it's very hard for us to enforce the the the the text within the dog string right because it's just
1717.8200000000002,1722.8600000000001,the person who's writing the function saying you know the input list should not be empty or you know
1722.8600000000001,1727.98,these the input two input lists like in the previous example should be the same length and there's
1727.98,1731.8200000000002,no way for us to really enforce that it's just something that's nice to have and we're going to
1731.8200000000002,1738.38,guarantee that the code runs if these things are upheld but it turns out that assertions are actually
1738.38,1744.8600000000001,a nice way for us to add to a nice thing to add to our functions that do try to enforce these this
1744.8600000000001,1751.98,contract through the specification so the way we create an assert we say assert and i'm asserting
1751.98,1758.22,that this statement is true so if i want that the input length for a function to be non-zero i would
1758.22,1765.18,assert that the length l is not equal to zero or something like that and if the assertion is true
1765.18,1770.8600000000001,right if that condition is met then the code carries on as normal but if the assertion is not true
1770.8600000000001,1777.42,then python ends with an assertion error and then some message that the condition was not true
1777.42,1783.0200000000002,and these are really nice because it holds the execution of a program as soon as that contract is not
1783.0200000000002,1788.8600000000001,held right as soon as something within the specification has gone wrong then the program terminates
1788.8600000000001,1793.9,with those assertion errors and it's nice to see them because if you're debugging your code you don't
1793.9,1802.38,want to propagate bad values or bad values through functions because that value might get propagated
1802.38,1807.9,later and later and later and then it would make your debugging very hard okay so if you stop the
1807.9,1814.94,execution as soon as something is just strange or off as in something like an assumption on
1814.94,1825.1000000000001,parameters not met then that's that's good so in our some digits example here is the code that we
1825.1000000000001,1831.66,wrote last so total down to the bottom is exactly what we had before all we're going to add is this assert
1831.66,1837.3400000000001,statement up here that the length of s is done empty because part of my contract here is that s is a
1837.3400000000001,1842.78,non-empty string right so that's a nice thing to assert if the user ever gives us an empty string the
1842.78,1851.34,program will terminate so in this example here I've got the some digits with the assert so if the
1851.34,1860.54,user gives us an empty string no total was created and the assert was immediately false right so length
1860.54,1868.3,s was equal to zero the assertion error was raised with the message s is empty so what I had here
1868.54,1879.1,if I have fine input then no assertion is raised and the code carries on as norm so that's nice
1882.7,1889.34,so let's have you add one more line of code to your the program that we just wrote just add an assert
1889.3400000000001,1897.5000000000002,statement that enforces the contract so I have l numb and l d numb are non-empty lists of equal
1897.5000000000002,1903.2600000000002,lengths so you can do this all in one assert statement or you can put two separate assert statements with
1903.2600000000002,1908.2200000000003,two separate messages however you'd like it is fine with me so I'll give you a minute to work on
1908.2200000000003,1917.18,that and then we can write it all right what assertions should I put in here yeah
1920.3000000000002,1934.0600000000002,so the thing I'm asserting should be true so I do I want them to be equal yes exactly so what
1934.0600000000002,1945.1000000000001,we I want l numb to equal l l yeah do you like that yep that's one right so the thing you want
1945.1000000000001,1950.5400000000002,you're asserting that this is true and if not comma we're going to put a message right list
1951.1000000000001,1958.94,lengths different or something like that do you want to do the other assert statement or does
1958.94,1968.46,this somebody else want to take a crack at the other assert so the other one is that they are
1968.46,1993.26,non-empty lists yeah so we can definitely do that not equal to zero comma
1993.26,2003.74,yeah I'm too list or something like that yep very nice so here we're trying to enforce our nice
2003.74,2009.66,contracts and I've got two examples down here so here I've got two different lengths of lists so
2009.66,2017.66,there you go my assertion has raised was raised with my nice message length differ and then the code
2017.66,2022.46,would immediately stop and it would force us to check to see why these lengths are different so
2022.54,2028.46,these bad lists won't propagate any further if I had larger pieces of code and then same here I've
2028.46,2043.82,got this assertion error that I have an empty list okay any questions so far okay one more example
2043.82,2048.7,I want to go through I'm not going to actually run this one but it is in the Python slides I just
2048.7,2055.8999999999996,wanted to give you another example of how we can use exceptions assertions in just a different
2055.8999999999996,2064.7,setting and it hopefully shows that as a programmer you get to choose how you add these exceptions
2064.7,2070.62,and assertions right so wherever they they seem reasonable to add you should add them so in this
2070.62,2077.98,particular example we are assuming that we have a class list in this case I only have two students
2077.98,2086.06,in my class so these are their test grades so I've got a list that looks like this it looks
2086.06,2094.22,complicated but I'll walk you through it this is one student in my list and this is another student
2094.22,2099.82,in my list so I've got a list of lists right where these things that I've highlighted in red is my
2099.82,2107.98,students and for each student I have more lists as part of their sort of information so the first
2108.86,2115.02,list related to one student is their name right the first element is the first name second element is
2115.02,2121.02,their last name and then the second list for that student is their grades in the class so just another
2121.02,2128.46,list of all the grades in the class okay so what I would like to do and this is the code I'm going to
2128.46,2137.9,go through is what is I'd like to create a new list based on the original grade a test grades
2137.9,2142.78,that contains the same information as before so you can see I still have two lists of students
2142.78,2149.34,the first row in the second row and in each student's information I again still have their name
2149.34,2155.58,and their list of grades but I'm adding one more item at the end for each student which is the
2155.58,2162.06,average of the list of grades so I've taken the average of these and plopped it as my integer or
2162.06,2169.02,float at the end and same with my next student so the code that's going to do this looks like this
2169.02,2176.38,I've got that's just the original list to give you an example to look at because I find it hard to
2176.38,2182.22,see things without examples so this is the code that gets the stats for the class so that creates
2182.2200000000003,2188.94,this new list containing my average at the end for each student in the class lists so for example
2188.94,2197.1800000000003,student here stew is going to be this list of two lists what I'm going to do in my new list that I'm
2197.1800000000003,2202.94,creating here new stats is I'm going to pen student at zero which is just their name so just a straight
2202.94,2208.46,copy and paste student at one which is just their grades again a straight up copy and paste of all their
2208.46,2216.94,list of grades and then I'm going to apply a function named average to the list of student grades
2219.7400000000002,2223.82,and what we're going to see in the next couple slides is we're going to see a few variations of
2223.82,2229.9,this average function and what happens when we when we apply these different these different functions
2230.2200000000003,2239.9,but for now I will assume that this code will do the job so the original average function will take
2239.9,2247.58,in a list of grades so this grades here will look like this blue box here right so just a list of numbers
2248.38,2253.98,it's going to sum all the grades so sum of all the elements inside the list and divide by how many
2254.06,2265.18,there are average okay now let's say that I have a student that contains no quiz grades or no
2265.18,2276.7,grades at all in that case their list of grades will be empty so if I try to apply the sum of all the
2276.7,2282.3,grades divided by the length of the grades for somebody who has no grades information that length
2282.3,2287.9,will be zero so I'm going to get a zero division error when I run my code and it will crash
2289.9,2297.9,so what I'd like to do is to change my average function to try to catch such an error so I'm
2297.9,2304.0600000000004,going to try to do the sum divided by the length and I'm going to catch this zero division error
2304.0600000000004,2311.26,inside this except block and all I'm going to do is print warning no grades data so for any student
2311.26,2317.0200000000004,that actually has grades information here the code will work the code to get the average will work
2317.0200000000004,2325.0200000000004,just fine because it will do the sum divided by the length but and then so that means the
2325.0200000000004,2330.0600000000004,tri block will succeed and we're going to return the sum divided by the length but if any student
2330.0600000000004,2337.26,enters the zero division error here we're going to print something and what do we return what is the
2337.26,2352.7000000000003,function return if we enter the except block that's what's going to be printed but what is this
2352.7000000000003,2360.78,function actually return what value none exactly right there's no return inside this except block
2360.78,2366.78,and no code after it either so you can see here if it successfully completes for these three students
2366.78,2372.1400000000003,we've got our numbers those that's what we return but for the last student that has no grades
2372.1400000000003,2380.3,information we're returning them okay I don't like that what I would like in my grades book is to have
2380.3,2389.6600000000003,numbers as my as my value there so instead let's add a return for that except for that except block
2390.6200000000003,2395.82,so we're still going to flag the error we still want to know that something weird has happened I don't
2395.82,2402.46,just want to replace return a zero without actually telling the user that something's gone down I
2402.46,2407.5800000000004,still flag the error but then I can return a zero so that it's still a number and then if I do
2407.5800000000004,2415.6600000000003,something with numbers at the end then it all works out this was a particularly hard first quiz 10 10
2416.14,2426.46,okay one last thing we can do is to just assert right so if we if we want to make sure that every
2426.46,2432.8599999999997,student had some sort of grades information maybe if the grades data was empty something weird
2432.8599999999997,2439.58,happened from a previous function that might have been called I don't know but maybe we say let's
2439.58,2445.5,just assert that the length of the grades is not zero so we only want this code to execute if
2445.5,2451.5,there are some grades information and if not let's just raise an assertion error just in case so we
2451.5,2459.2599999999998,can assert that the length of grades is not equal to zero and in that case the code will terminate
2459.2599999999998,2464.7799999999997,as soon as we try to get that last student's information right it will crash and it will crash with
2464.78,2470.1400000000003,this assert statement that there's no grades data and then we can go back to the code and see did
2470.1400000000003,2475.1800000000003,we actually expect the student to have information or not and then we can you know try to work through
2477.98,2486.38,so just a quick summary of exceptions and assertions hopefully this lecture kind of demystified
2486.38,2493.1000000000004,some of these exceptions that we've been getting it showed you they're not as scary as they might have
2493.1,2500.62,seemed originally they don't always have to terminate the program right you can catch them
2500.62,2505.66,you can deal with them in whatever way that makes sense for that particular function or program
2505.66,2512.62,you can print a nice output to the screen you can set some default values you can still terminate
2512.62,2517.42,the program but do it on your own terms with your own errors with your own custom messages so that
2517.42,2523.26,the users can see something nicer than the default Python messages right and so exceptions
2523.82,2529.02,exception handling is very important is a very important part of writing a program especially if
2530.06,2537.5,if you expect weird things to happen right assertions on the other hand are a type of exception
2538.06,2543.34,and they're useful as I've mentioned to try to enforce these these contracts these specifications
2543.34,2550.6200000000003,you basically use assertions because you don't want bad values to propagate okay so as soon as
2550.6200000000003,2559.26,something that isn't as you expect it to be happens assertion error is raised and the programming
2559.26,2567.1000000000004,media terminates allowing you to check to see why exactly those conditions were not met okay so that's
2567.1000000000004,2568.1400000000003,it that's all I had
2573.34,2575.9,you
