Start Time,End Time,Text
2683.72,2687.6,"Then the right piece of that base case, merging them back up."
2687.6,2692.2,"The right step, the left part of that right step,"
2692.2,2695.4,"the right part of that right step, merging them back up."
2695.4,2698.96,So then we do the merge step of 5 9 and 0 2.
2699.04,2703.28,"And then the merge step of these 2 2 lists, 1 4 6 8"
2703.28,2705.48,and 0 2 5 9.
2705.48,2707.32,So you can see it has a similar feel
2707.32,2709.7200000000003,"to exploring one side of the branch first,"
2709.7200000000003,2712.12,"just like with Fibonacci, for the exact same reason."
2712.12,2714.52,Because we've got a function called that's recursive.
2714.52,2717.48,We can't complete it until we've explored all the way down
2717.48,2719.12,to the bottom.
2719.12,2721.7200000000003,So the overall complexity of this is going
2721.7200000000003,2725.7200000000003,"to be the merge step itself is theta of n, like we just"
2725.7200000000003,2728.6,"talked about, but how many levels do we have?"
2728.6,2731.7599999999998,"That is, how many times do we take our original list"
2731.7599999999998,2736.0,and subdivide it until we get to our base case?
2736.0,2738.12,And the number of times is according
2738.12,2740.04,to this function very much like when we did
2740.04,2743.72,"bisection search, we're going to take an original n elements"
2743.72,2744.3199999999997,in my list.
2744.3199999999997,2748.12,And I'm going to keep dividing this n elements by 2
2748.12,2751.3199999999997,"in a bunch of sub lists, i times."
2751.3199999999997,2753.64,So i times is how many times we're
2753.64,2756.2799999999997,going to subdivide this list until we get to a base case.
2756.2799999999997,2758.12,So what is i in terms of n?
2758.12,2761.96,"Well, i is equal to log of n."
2761.96,2768.52,"So at each sub level, I've got a merge step."
2768.52,2773.4,So I've got theta of log of n levels multiplied
2773.4,2776.3199999999997,by theta of n for my merge step.
2776.3199999999997,2778.6,So the overall complexity of this function
2778.6,2781.6,"is theta of n log n, where n is the length of the list."
2781.92,2784.92,OK.
2784.92,2786.64,OK.
2786.64,2790.7999999999997,So it turns out that theta of n log n is actually the fastest
2790.7999999999997,2792.68,we can have a sort b.
2792.68,2796.0,You cannot do a sorting algorithm that's faster than that.
2796.0,2799.12,You can do little tricks here and there based on your data.
2799.12,2801.7599999999998,Maybe you don't divide the list exactly in half.
2801.7599999999998,2805.08,Maybe you divide it and you find some sort of pivot point
2805.08,2807.2,that's a little bit smarter about the data.
2807.2,2811.16,"But in general, the complexity of this function of a sorting"
2811.16,2813.6,algorithm is always going to be the fastest
2813.6,2817.0,it's going to be as theta of n log n.
2817.0,2819.2799999999997,All right.
2819.2799999999997,2823.0,We've seen a bunch of different algorithms
2823.0,2826.48,here to help us design programs.
2826.48,2829.48,So the reason why we do this complexity analysis
2829.48,2831.8799999999997,is to guide the design of a program.
2831.8799999999997,2835.08,So if you already have a bunch of nested for loops
2835.08,2837.64,"in the program that you're trying to consider writing,"
2837.64,2839.6,you'll already know it's going to be pretty inefficient
2839.6,2840.12,and slow.
2840.2,2843.88,So you might want to rethink the design to begin.
2843.88,2845.88,OK.
2845.88,2846.88,All right.
