Start Time,End Time,Text
0.0,23.0,"So today marks the last lecture on the subject of sorting algorithms, or on the subject"
23.0,29.16,"of complexity, and specifically we will be talking about sorting algorithms."
29.16,33.56,So let's remember where we left off at the end of last lecture.
33.56,39.04,"We tried to look for elements within a list, and this is a really common problem in computer"
39.04,44.96,"science, where the list is basically a large data set that you might have gathered on,"
44.96,51.72,"I don't know, biology information, or physical experimental data, some big file of data,"
51.72,56.36,and one of the most common things you might want to do on such a file is to search for something
56.36,60.6,"within that file. Basically you'll read it in as a list, and you'll search for something"
60.6,66.24,of interest within this list. So we saw two algorithms to search for an element within
66.24,73.6,a list. The first was just a straight-up linear search. That linear search we did on an unsorted
73.6,79.72,"list, and we also did it on a sorted list. And what we saw was at the worst-case time complexity"
79.72,85.28,for searching for an element within a list using linear search was theta of n. That's
85.28,92.4,"the best that we could do. Now, we saw the binary search algorithm as an alternate way"
92.4,96.88,"to search for an element in a list, but the caveat to using the binary search algorithm was"
96.88,103.08,that we had to have a sorted list. We can't use this binary search algorithm on an unsorted
103.08,109.26,"list, because it will give us an incorrect answer. So assuming the list is sorted, binary"
109.26,114.76,search does a much faster job at finding the element within a list. It does it in theta
114.76,122.12,"of log n time, which is faster than theta of n. The timings through a code that we did"
122.12,126.84,"showed this, counting the number of operations showed this, and then the theory also showed"
126.84,135.32,"this. Alright, so clearly it is better to use binary search because it's faster, but when"
135.32,141.6,"does it make sense to use binary search? So the idea is, given some sort of data set,"
141.6,147.96,"write some list of elements, we would have to first sort them in order to do binary search."
147.96,154.04,"So the question then becomes, the time that it takes for us to do a sort. Plus the time"
154.04,159.04,that it takes for us to use binary search to look for an element within that list should
159.04,164.2,"be less than the time that it takes for us to do linear search. In that case, it makes"
164.2,169.48,sense for us to do a sort and binary search. This implies that the time it takes for us to
169.48,177.32,"sort is less than the subtraction, so theta of n minus theta of log n. So this implies"
177.32,183.64,that we can sort a list in less than theta of n time. That means we can sort a list without
183.64,189.23999999999998,"even looking at each element in the list. And that's not possible, right? We have to at"
189.23999999999998,193.83999999999997,least go through each element in the list one at a time to determine that that list is
193.84,200.08,"sorted to begin with, right? So even in the best case scenario to sort a list, that's"
200.08,207.72,"going to be theta of n time. So clearly, this will never be true. So then the question becomes"
207.72,212.76,"why do we bother doing binary search in the first place? Well, that's because oftentimes"
212.76,220.4,"if you download a data set, or you want to do some search on some list or some data set"
220.4,224.92000000000002,"that you get, most of the time you're not going to want to do it just once. You're going"
224.92000000000002,231.16,"to want to sort that list one time, and then do a whole bunch of searches for a whole bunch"
231.16,237.08,of different things within that list. So if we can somehow amortize the cost of doing one
237.08,245.76,"sort over K different searches, as K gets really, really big, it makes sense to do binary"
245.76,252.35999999999999,search on the sorted list rather than just to look through using linear search K different
252.35999999999999,256.96,"times, right? So then that time to do the sort only once kind of gets absorbed and goes"
256.96,263.58,"to zero as the number, the K number of searches goes to some really big number, right? So"
263.58,270.28,"clearly, we've shown that if you want to do many searches on a data set, it makes sense"
270.28,275.15999999999997,"to do the sort only once. All right, so now we're going to look at a bunch of different"
275.16,279.0,"sorting algorithms. We're going to start with some really bad ones, and then we're going"
279.0,283.92,to work our way up to what is considered one of the best sorting algorithms the best that
283.92,290.52000000000004,"we can do. So let's begin by showing a really, really bad sorting algorithm, and there are"
290.52000000000004,295.36,actually competitions where people can come up with really bad sorting algorithms that kind
295.36,302.72,"of sort lists in a really weird way while being really bad, still making forward progress,"
302.72,308.8,"and this is one of them. So this one is called Bogosort, coming from Bogos sort, also called"
308.8,314.32000000000005,"random sort or monkey sort. So the idea here, and I'm going to use these cards as we look"
314.32000000000005,319.48,"at these different sorting algorithms, the idea of Bogosort is that we're going to use randomness"
319.48,328.72,"to help us sort the list. So if we want it to sort a list or a deck of cards, for example,"
328.72,332.36,"the idea of Bogosort is that we're going to take all our cards, we're going to throw"
332.48,336.48,"them up in the air, we're going to pick them up as they land, and we're going to check to see"
336.48,340.72,"if they're sorted. If they are, we're done. If they're not, we're going to repeat the process."
340.72,344.08000000000004,"We're going to throw them up in the air, let them fall where they may, and then we're going"
344.08000000000004,351.36,to check if they're sorted. So the code would look something like this. It takes in a list
351.36,357.56,"L, and it says, while the list is not sorted, we're going to call this shuffle function from"
357.6,362.8,"the random library, and the shuffle function just re-shuffles or rearranges the elements"
362.8,369.8,in the list at random. So let me show you how that looks like. So here's the sorted function.
379.0,386.72,"I'm going to run it. So it starts out with this list of obviously elements not in order,"
386.72,393.04,and it took about 0.2 seconds to just randomly keep re-shuffling the elements of the list
393.04,398.04,"to give me, for them, to become in sorted order. So it did about 30,000 shuffles, and if"
398.04,403.28000000000003,"I run it again, it will take a completely different amount of time each time it's run. So now"
403.28000000000003,407.92,"it was really fast, but if I keep running it, one time I ran it last night, it took about"
407.92,414.92,two seconds. So you can see it's just random. So what's the complexity of this function?
414.92,420.12,"Clearly, it's not going to be very good at best. So in the best case scenario, let's say"
420.12,426.08000000000004,"my input list is already sorted. So in the best case scenario, the theta would be just theta"
426.08000000000004,430.88,"of n, where n is the length of the list, because we have to look at each element once to make"
430.88,436.64,"sure that it's in its rightful place. But in the worst case scenario, the theta complexity"
436.64,442.08000000000004,"of this is unbounded, so infinity. Because at worst case, we're going to be super unlucky,"
442.08,448.84,"and we're just never going to get the elements in a sorted order. So clearly, not a very"
448.84,453.47999999999996,"good sorting algorithm. If you go to the Wikipedia page for this, it'll give you a whole bunch"
453.47999999999996,461.0,"of other examples of algorithms similar in this spirit of being bad, but making forward"
461.0,467.28,"progress towards an answer. So next, we're going to look at a different sorting algorithm,"
467.28000000000003,473.16,"a bubble sort. And it's one of the most popular sorting algorithms, not because it's good,"
473.16,479.76000000000005,but because people really like to make fun of it. So it's best to understand it. So the idea
479.76000000000005,486.72,of bubble sort is that we're going to start with an originally un-sorted list. And like
486.72,494.08000000000004,"I said, I'm going to use this as an example. And we're going to try to compare consecutive"
494.08,502.68,"elements one at a time. And as we do so, we're effectively going to bubble up the largest"
502.68,509.56,element towards the end of the list. So we're going to start our first pass on this clearly
509.56,514.3199999999999,un-sorted list. And we're going to compare the first two elements. If the element at index
514.3199999999999,522.0,"i is smaller than the element at index i minus 1, then I'm going to do a swap. So here they"
522.0,526.0,were. So I did a swap. Then I'm going to compare the next set of elements. So these two are
526.0,531.92,already sorted. These two are not. So I'm going to swap them. These two are not. I'm going to swap
531.92,536.4,them. These two are not. I'm going to swap them. They're not. I'm going to swap them. And these
536.4,542.32,two are not. And I'm going to swap them. Okay. Just put it over because that table got in the way.
543.84,551.04,"All right. So after I finished my first pass, this number 11 effectively bubbled up from wherever it"
551.04,556.48,"was towards the end of the list, the place where it belongs, basically. It belongs at the end of"
556.48,562.9599999999999,"the list because it's the biggest number. Since I've done at least one swap on that previous run,"
563.5999999999999,569.12,"I'm going to go through again. Because in the process of doing a swap, I might have disarranged"
569.12,574.48,something that was already sort of in order. So now I'm going to start all over again. I'm going
574.48,579.76,"to say, are these two in sorted order? They are. Are these two? No. So I swap. Are these two"
579.76,588.16,"no. So I swap. Are these two? No. So I swap. I swap. And I swap. And now after two passes, I have"
588.16,597.52,"effectively bubbled up the next biggest number. All right. You guys can see. Okay. Next time through,"
598.72,606.3199999999999,"next time through, I'm going to have to go again because I am, I did one swap last time. So again,"
606.32,610.4000000000001,"I'm going to compare these two. I need to swap them. These two, I need to swap them. These two,"
610.4000000000001,614.8000000000001,I need to swap them. Swap them. Swap them. Swap them. And these are in order. And these are in order.
616.0,620.96,"Again, five in the four needs to swap. Five in the one needs to swap. Five in the zero needs to swap."
620.96,625.2,Five in the two needs to swap. These are in order. These are in order. These are in order. Four in
625.2,630.24,the one needs to swap. These two need to swap. These need to swap. Order ordered ordered ordered ordered.
630.24,636.0,"Next, these two need a swap, these are okay, these are okay, and so on."
636.0,643.44,"And now that I've not, I'm going to do one final check, these are all in order, right?"
643.44,650.08,"So now that I haven't done any more swaps, I can say that this list is now in sorted order."
650.08,655.64,"So with each pass, I'm bubbling up the biggest element towards the end of the list."
655.64,665.48,"So at the end of n passes, the top, the last n elements, will be in sorted order, okay?"
665.48,668.4399999999999,So the code looks something like this.
668.4399999999999,675.8,I've got a Boolean flag here that keeps track of whether or not I have done a swap.
675.8,680.3199999999999,"If I've done a swap, then I know I need to go through and double check that everything"
680.32,686.24,is still in order by comparing index i and i minus 1.
686.24,692.0400000000001,"So to do that, we've got a for loop that goes through from 1 all the way up to the end"
692.0400000000001,696.4000000000001,of the list because I'm going to compare element at index i with i minus 1.
696.4000000000001,699.6800000000001,"If I started at 0, we'd get an index out of bounds error."
699.6800000000001,701.6,So that's why I start with 1 over there.
701.6,706.32,"And then the inside of the for loop just checks if the element at, I guess j, I use j instead"
706.32,709.7600000000001,"of i, j and j minus 1 are in the right order."
709.76,714.08,"Now, obviously they are, but when I first started this demo, they were not, right?"
714.08,719.24,"So as long as this j minus 1 and j are not in order, do a swap."
719.24,725.36,"So here I just change, I use this sort of, this, this tuple trick here to do the swap of"
725.36,728.68,element j minus 1 and j.
728.68,733.52,"And I also reset the Boolean flag that I did the swap to true, okay?"
733.52,739.72,"And this goes through until I don't do any more swaps, and then the code will not"
739.72,743.08,go through the while loop anymore.
743.08,749.24,So let's print how this actually looks like when we run it on our list.
749.24,754.5600000000001,So here I have my original list.
754.5600000000001,764.84,"Each set here, delineated by this line break, represents one loop of my while loop."
764.84,767.64,"So this thing here, right?"
767.64,770.08,One iteration of my while loop.
770.08,777.22,And each line within here represents one iteration of my for loop.
777.22,783.04,"So what we can see is that as we're comparing the four and the eight, the eight bubbles"
783.04,791.0,"up one step over, then we compare the eight and the six, the eight bubbles one itself over"
791.0,795.8,and so on and so on until it encounters the 11 and then the 11 starts to bubble itself
795.8,797.36,up all the way to the end.
797.36,803.08,"So at the end of the first while loop pass, my 11 is in its rightful spot at the top"
803.08,805.64,"of the list, at the end of the list."
805.64,809.6800000000001,"Next time through the while loop, I'm effectively bubbling up the eight to the end."
809.6800000000001,814.12,"So over here, next time through the while loop, the six bubbles to the end, next time the"
814.12,825.88,"five bubbles through the end, then the four, then the two, then the one, and then the zero."
825.88,832.88,"So what's the, yeah, question?"
832.88,841.48,"Oh, we don't need the brackets, you can put them in, it won't harm, but if you don't put"
841.48,842.48,"them, it's okay."
842.48,847.6,"Python knows that it's doing an assignment, one by one, so this one to that one and that"
847.6,852.56,one to that one.
852.5600000000001,856.0400000000001,"Okay, so let's look at the worst case complexity analysis."
856.0400000000001,860.48,"So the easy one we can already know is this inner four loop, right?"
860.48,866.08,"This one goes through from one to the length of the list, so that's state of length list."
866.08,871.5600000000001,"We have another complexity though, because in the worst case scenario, our list is completely"
871.5600000000001,873.2,backward.
873.2,879.6,And so this while loop up here will repeat length L times because we're going to bubble
879.6800000000001,884.44,up every single one of the elements all the way through to the end of the list.
884.44,889.48,"So the complexity of that while loop will be fate of length L as well, because thinking about"
889.48,894.88,"the worst case is when our biggest element is here, second biggest element is here, and"
894.88,895.88,so on.
895.88,898.9200000000001,"Okay, all right."
898.9200000000001,903.9200000000001,"So the worst case complexity of this function is state of length L squared, right, or"
903.9200000000001,908.6400000000001,"state of n squared, where n is the length of the list, just to be less verbose."
908.6400000000001,913.32,"Okay, clearly not a great sorting algorithm."
913.32,915.4000000000001,It's pretty inefficient and some of the things it's doing.
915.4000000000001,920.8800000000001,"I once it's reached, you know, sorted some of the stuff up here, it keeps comparing them"
920.8800000000001,924.96,"through to the end, so it just always goes through to the length of the list."
924.96,931.1200000000001,"We can do, we can look at another sorting algorithm called selection sort, which is sort of"
931.12,936.28,"like bubble sort, but it does things in a little bit of a smarter way."
936.28,942.4,"So let me start again with a unsorted list, okay."
942.4,951.64,"And let's see how selection sort will do this, okay, let's put them there."
951.64,960.64,"Okay, so the idea of selection sort is that with each pass, we're going to decide which one"
960.64,964.52,of these elements belongs at some index.
964.52,969.92,"So with my first pass, I'll decide which element belongs at index zero."
969.92,975.24,"With my second pass, I'll decide which element belongs at index one, with my third which element"
975.24,977.84,"belongs at index two, and so on."
977.84,982.28,"Okay, so the way we're going to do that is by saying, all right, I'm going to take this"
982.28,986.64,"element, it's the first one in the list, it's the one currently at index zero, and I'm going"
986.64,991.96,to compare it with every single element from the rest of the list.
991.96,996.48,"And as I find an element that's smaller than the one currently there, I'm going to swap"
996.48,1000.6,them because I know that smaller one obviously belongs at index zero.
1000.6,1003.52,"So I'm going to compare the five with the eight, I'm going to say, well, the five is smaller"
1003.52,1006.68,"than the eight, so it currently belongs at index zero."
1006.68,1011.04,"I compare the five with the one, the one is smaller, so I'm going to do a swap and say"
1011.04,1012.84,the one belongs here.
1012.9200000000001,1019.44,"One with the 11, the one belongs here, one with the six, the one belongs, one with the two,"
1019.44,1024.52,"the one still there, one with the zero, well, zero smaller than one, so let me swap it."
1024.52,1026.8,"Zero with the four, we're done."
1026.8,1031.08,"So now, at the end of the first pass, I've decided that the zero is the smallest out of"
1031.08,1035.16,"everybody here, so it belongs at index zero."
1035.16,1039.76,"Next time, my second pass, I'm not going to worry about this one, I know it's already"
1039.76,1044.82,"the smallest, so I'm going to determine which element belongs at index one, right?"
1044.82,1048.32,"So the eight is the first one there, it's the one currently at index one, so I'm going"
1048.32,1052.68,"to start with it being the one that belongs there, and I'm going to successively compare"
1052.68,1054.48,it with everybody else.
1054.48,1059.32,"So the eight with the five, the five clearly is smaller than the eight, five with the 11,"
1059.32,1062.8,"the five is smaller, five with the six, the five is smaller, five with the two needs"
1062.8,1068.8,"a swap because the two is smaller, two with the one, again, we swap, the one is smaller,"
1068.8,1071.52,"and then one with the four, done."
1071.52,1076.3999999999999,"So at the end of the second pass, I've decided that the one belongs at the next index, so"
1076.3999999999999,1080.8799999999999,"now, these two elements are in their correct place, they're in sorted order."
1080.8799999999999,1086.48,"Okay, third pass, we're going to decide which element belongs at the next index, right?"
1086.48,1087.56,The index two.
1087.56,1092.28,"So eight with the 11 is okay, eight with the six, we need to swap, six with the five, we"
1092.28,1098.08,"need to swap, five with the two, we need to swap, two with the four, everything's okay."
1098.6399999999999,1102.84,"Three passes, the first three elements are in sorted order, now, we just need to figure"
1102.84,1108.1999999999998,"out between these leftovers, which one belongs at the next level."
1108.1999999999998,1114.04,"So eight with the 11, we do a swap, eight with the six, we do the swap, six with the five,"
1114.04,1122.0,"we bring the five here, five with the four, we bring it here, okay, again, 11 with the eight,"
1122.0,1127.52,"we swap these, eight with the six, we swap these, six with the five, we swap them, right?"
1127.52,1131.8,"So as you can see, as I'm making my way through to figure out which elements belongs at the"
1131.8,1139.4,"next index, I have fewer elements to decide between which belongs at the next index, right?"
1139.4,1146.56,"So here, the eight, the 11 needs to swap, eight with the six needs to swap, and then lastly,"
1146.56,1148.96,"like that, okay."
1148.96,1156.6,"Okay, so slightly more efficient in that we're not comparing a bunch of pairs all the time"
1156.6000000000001,1161.68,"all the way through to the length of the list, so the code looks like this, I've got one"
1161.68,1168.0400000000002,"four loop that goes through the length of the list, and one inner four loop that only"
1168.0400000000002,1172.1200000000001,"starts at i and goes through to the end of the list, right?"
1172.1200000000001,1175.8000000000002,"So unlike bubble sort, which started at one and went through to the end of the list all"
1175.8000000000002,1182.16,"the time, here I'm starting at i and going through to the end of the list, because in selection"
1182.16,1188.2,"sort, with each pass, I've decided which element belongs at a specific index, so I no"
1188.2,1192.92,"longer need to worry about comparing that element with everybody else, right?"
1192.92,1197.68,"So when we were, you know, we were like that, we had decided these were in sorted order,"
1197.68,1202.8000000000002,I only needed to compare these three amongst themselves to decide which one fit at the next
1202.8000000000002,1206.72,"spot, everybody else was already sorted."
1206.72,1208.96,So what's the complexity analysis of this?
1208.96,1213.76,"This is going to be feel very similar to diameter from last lecture, because diameter also"
1213.76,1219.56,"had this funky thing where we started from i and went through to the length of the list,"
1219.56,1225.0,"well it's going to be theta of length L squared again, so there's two ways to think about this,"
1225.0,1226.0,okay?
1226.0,1232.2,"The first one is to look at each loop individually, clearly the outer loop goes through theta"
1232.2,1234.3600000000001,"of length L, right?"
1234.3600000000001,1237.8,"No question about that, that just goes through range of length L."
1237.8,1239.9199999999998,"The inner loop is a little bit trickier, right?"
1239.9199999999998,1245.6399999999999,Because it doesn't always go from some fixed number to the length of the list.
1245.6399999999999,1250.44,"But what we can think about is on average, right?"
1250.44,1255.76,"The first time, when we were trying to figure out the element that belongs at the first index,"
1255.76,1260.84,"or index zero, we went through to the length of the list, we had to compare with everybody else."
1260.84,1266.04,"The next time we have to compare with lengthless minus one, then lengthless minus two, and then"
1266.04,1269.44,"at the end, we only had one item to compare."
1269.44,1274.52,"So on average, that inner loop goes through length L over two times, right?"
1274.52,1283.24,"On average, we have to look through about half of the elements in the list to do the comparison."
1283.24,1291.52,"So if the inner loop here on average is theta of length L, is length L over two, right?"
1291.52,1295.84,Then the theta of length L over two is theta of length L.
1295.84,1299.84,There's just the 0.5 in front of that.
1299.84,1303.6399999999999,So that's the first way to think about the complexity analysis of this.
1303.6399999999999,1311.72,"The other way is to ask yourself, well, what part of this code is doing the repetitions?"
1311.72,1318.0,"Like if we were to think about what we're counting in terms of units, which part of this code repeats?"
1318.0,1321.28,"Well, the stuff inside the inner four loop repeats, right?"
1321.28,1325.24,So you're going to do a whole bunch of comparisons.
1325.24,1329.4,So how many actual comparisons will you do?
1329.4,1336.0,"Well, the very first time, from the outer first pass, through to the end of the list,"
1336.0,1339.44,you're going to do approximately length L comparisons.
1339.44,1344.32,"The next time, you're going to do length L minus one comparisons, then length L minus two comparisons,"
1344.32,1347.96,"and so on and so on, down to only one comparison."
1347.96,1352.52,"So if we do that sum one plus two plus three plus all the way up to length L,"
1352.52,1356.84,that formula becomes length L times length L plus one over two.
1356.84,1361.04,"So that becomes length L squared over two plus length L over two,"
1361.04,1365.84,and that becomes theta of length L squared.
1365.84,1369.84,So just a couple ways to think about the analysis of this.
1369.84,1373.8,"And this is a pretty common thing you'll see, but just because we start at I,"
1373.8,1379.92,doesn't mean that it decreases the complexity of this function dramatically.
1379.92,1381.6,It doesn't decrease it by some order.
1381.6000000000001,1384.0400000000002,It just decreases it by half.
1384.0400000000002,1391.0400000000002,So it's still theta of length L.
1391.0400000000002,1397.5600000000002,"OK, so we can actually do a little variation on this,"
1397.5600000000002,1402.4,because you might have noticed it was a little inefficient to do the swap
1402.4,1406.5600000000002,every time I noticed another element that's smaller.
1406.5600000000002,1409.2400000000002,I didn't have to do the switch.
1409.24,1415.0,All I had to do was kind of just keep track through a variable of the smallest number
1415.0,1420.0,"that I have seen so far, and only do the switch at the end when I've determined"
1420.0,1422.32,that that's the smallest number.
1422.32,1425.64,"So the variation, basically, if this is my list, says, hey,"
