Start Time,End Time,Text
2699.68,2716.68,"So this is just the conventional way of calling methods and it's the way we've been working with lists and dictionaries and things like that. So again, we've got some object, the thing before the dot, some method to run."
2716.68,2727.68,"And when we call it this way, the thing before the dot becomes self in our class definition, right, in our method definition, and then all the other parameters become assigned one by one."
2727.68,2730.68,"Right, everything except for self."
2730.68,2742.68,"Now to sort of demystify this, I would like to show you what this is actually equivalent to. So we can run the function, the method that we defined using by actually passing in a value for self."
2742.68,2758.68,"If this is more, if this is clear to you. So in that case, the thing before the dot cannot be an object, right, because if it is an object of the type coordinate, then Python will say well, this is the object I'm running the distance method on."
2758.68,2768.68,"So to demystify this, you can actually invoke the name of the class, right, the object that you're trying to create the name, the data type, right, coordinate."
2768.68,2782.68,"And then Python says, oh, I see, you're calling the name of the class. It's not an object, so then what do you want from me? Okay, the thing after the dot says I would like to run this method on you."
2782.68,2788.68,"But now it needs all the parameters in the parameter list, including self."
2788.68,2800.68,"So here I would set, you know, I would have to give it explicitly, see comma zero instead of just zero, because the thing before the dot is the name of my class, not an actual object, like it is on this side."
2800.68,2816.68,"So this is actually the conventional way to do this, right, this is the shorthand, the python way to do this. But this hopefully demystifies the self deal and the way we actually, you know, set that first parameter to the thing before the dot."
2816.68,2828.68,"Alright, yes, question. Yeah, exactly. If there's more parameter, just pop in those extra ones with commas, just like a regular function."
2828.68,2838.68,"So this dot operator basically accesses either our data, c.x, or our methods, right, c.distance, whatever or whatever method name we have."
2838.68,2852.68,"So that's it for today's lecture. Next lecture we're going to build on this coordinate object by creating circles, and then we'll create some fraction objects, and we'll look at some other way, some other objects that we can bundle together."
2852.68,2854.68,Thank you.
