Start Time,End Time,Text
1215.8,1219.48,"We're going to, you can see here, this is the code that implements the class."
1219.48,1226.1200000000001,So this will tell Python that we are now creating this object type coordinate.
1226.1200000000001,1231.04,"So we're not using it yet, we're not creating any objects, any object instances, we're just"
1231.04,1234.76,telling Python that we'd like to create this object type.
1234.76,1240.96,"So we start with the keyword class, right, in parallel, we started with a keyword df to define"
1240.96,1241.96,a function.
1241.96,1247.2,"Then we say the name of our object type, so this will be literally the type of the object."
1247.2,1251.52,"So coordinate, just like we had list, int, float, you know, all those things, this will be"
1251.52,1253.8,of type coordinate.
1253.8,1257.56,And then in parentheses here we say the parent of this class.
1257.56,1262.36,So usually we say object until two lectures from now when we're going to see what happens
1262.36,1264.36,when we put something else in there.
1264.36,1268.9199999999998,"But when we put object in the parentheses there, we're telling Python that anything a generic"
1268.9199999999998,1272.96,"Python object can do, our object can do as well."
1272.96,1281.56,So something really basic is saying that I'm going to create this object in memory and
1281.56,1286.04,"assign a variable to it, so that I get a handle for that object using this variable, right,"
1286.04,1291.48,"using super basic, any Python object has this ability and ours will too, because I've"
1291.48,1297.36,"put this object in the parentheses here, okay, all right."
1297.36,1302.32,"So now we've told Python, we're creating a data type called coordinate."
1302.32,1305.56,What are we going to fill in the body of this class?
1305.56,1309.96,"So the things we need to fill in are going to be our attributes, okay, now again what makes"
1309.96,1310.96,up an object?
1310.96,1316.0,"Two things, the data that you want to represent this object with, and the procedures."
1316.0,1322.64,"AK functions, AK behaviors that you'd like this object to have, okay."
1322.64,1327.0,"So the data will be two things, right, we decided that we're going to represent a coordinate"
1327.0,1329.6,"using two numbers, okay."
1329.6,1332.08,Now what about behaviors?
1332.08,1338.08,Behaviors will essentially be functions that work with objects of this particular type.
1338.08,1341.56,So we're going to define them as functions but we're going to define them in a really special
1341.6,1348.48,"way that tells Python you can only run this function on an object of type coordinate, right,"
1348.48,1349.6399999999999,which makes sense.
1349.6399999999999,1354.36,"I would not like to find the distance between, you know, two integers, that's just subtraction"
1354.36,1358.56,"or I would not like to find the distance between two dictionaries, what does that even mean?"
1358.56,1362.96,So distance method that we mentioned is one thing we'd like to implement will only work with
1362.96,1366.32,"objects of type coordinate, okay."
1366.32,1371.96,"So these special functions are actually called methods, okay, and I'm going to use this"
1371.96,1376.56,"term a little bit today, hopefully you get used to it and then from now, from there, from"
1376.56,1381.28,next lecture on I'll just use the word methods to refer to functions that only work with objects
1381.28,1389.76,"of this type, okay, so we so far in the previous slide had class coordinate object."
1389.76,1392.6399999999999,Now what is the next thing you have to do?
1393.0400000000002,1397.48,The next thing you always have to do when you tell Python you're creating a new data type
1397.48,1405.2800000000002,"is to tell Python how you want to construct this data type, okay, kind of a constructor,"
1405.2800000000002,1407.8000000000002,a constructor function.
1407.8000000000002,1412.68,"And the way we do this is by defining, so you can see we're defining it like a function,"
1412.68,1418.2,"DF, but we're going to define a function that has a special name and the name is double"
1418.2,1424.8400000000001,"underscore in it, double underscore, okay, so that's the name of this function and"
1424.8400000000001,1428.8,"you can see it's a function, DF name, and then parentheses, and there's a bunch of stuff"
1428.8,1429.96,in the parentheses.
1429.96,1434.16,"The first thing will be this thing called self, so already it's going to be a little bit"
1434.16,1437.44,different than regular functions.
1437.44,1443.3600000000001,"Now I'm going to, this is not the only time I'll explain self, I'll explain it throughout"
1443.4,1449.92,"this lecture, but the basic idea of self is that it's always going to be the first parameter"
1449.92,1456.16,"of a method, right, a function that only works with an object of this class, of this type."
1456.16,1462.0400000000002,And the reason why we have it here is because all we're doing here is telling Python that
1462.0400000000002,1465.0400000000002,we'd like to create this object type.
1465.0400000000002,1470.8400000000001,"We don't have an actual object to manipulate, right, I haven't created an actual object yet."
1470.84,1474.4399999999998,"I'm just telling Python, I'd like to create this object."
1474.4399999999998,1481.9599999999998,"So if I don't have an actual object created yet, I need some way to refer to an instance"
1481.9599999999998,1487.6,"without actually having one yet, and that's what the self is doing, right, it's basically"
1487.6,1493.76,"a variable that tells Python that this is an object of, that this is a function that only"
1493.76,1500.72,"works with an object of this type, and I'm going to use this variable self to refer to"
1500.72,1506.72,"this object, myself, my data attributes, and my methods, and things like that."
1506.72,1510.8,"So we'll become clear, there will be many examples, but for now it's basically a way for"
1510.8,1515.6000000000001,"us to refer to an object of this type, an instance of this type without actually having created"
1515.6000000000001,1517.72,one.
1517.72,1523.6000000000001,Anything after self is basically a parameters you'd like to create this object with.
1523.6000000000001,1529.84,"So for us, it doesn't make sense to say create this coordinate object without actually initializing"
1529.8400000000001,1534.2,"its x and y values, right, when we put a coordinate object in a 2D plane, I would like"
1534.2,1540.2400000000002,"to put it in that 2D plane, so it needs an initial x and initial y value, okay, so these"
1540.2400000000002,1544.4800000000002,parameters here will tell Python you need to pass in a value for x and y when you create
1544.4800000000002,1554.0800000000002,"your object, and then the body of this in it will have whatever code you'd like to initialize"
1554.08,1562.3999999999999,"your object, yes, question."
1562.3999999999999,1565.76,"The underscore is part of how you write it, so you have to have underscore underscore in"
1565.76,1569.84,"it, underscore underscore, yeah, it's a special function, we'll talk about the next lecture,"
1569.84,1578.28,"it's called a dunder function, double underscore function, dunder, okay, okay, so the body of"
1578.28,1583.04,"this function can contain a bunch of initialization codes, so anything you'd like to initialize"
1583.08,1589.1599999999999,"when you create an object of this type, that's what you stick in here, okay, usually most"
1589.1599999999999,1595.36,"of the time, 99% of the time, you want to initialize the data that makes up your object, right,"
1595.36,1600.36,so the data we decided makes up our object is how far you are in the x-axis and how far
1600.36,1607.04,"away you are in the y-axis, so here, this data that I want every single one of my objects"
1607.04,1614.2,"to have, a value for x and a value for y, is initialize using self-dot, right, so self-dot"
1614.2,1621.24,"a variable named x and self-dot a variable named y, and the self-dot before these variables"
1621.24,1627.44,"distinguishes these variables x and y here from regular variables, right, if I were to"
1627.44,1632.92,"just say x equals x-val and y equals y-val, x and y will just be regular variables, as"
1632.92,1638.2,"soon as my init function terminates, those variables are gone. But because I've got self-dot"
1638.2,1644.52,"x and self-dot y, this means that these values x and y will persist throughout the lifetime"
1644.52,1650.96,"of my object, when I create my actual object, and every single object I create will have their"
1650.96,1654.2,own x and y values. Question?
1654.2,1662.04,"Does it have to be different to be x-val, so kind of the set of x-val, or?"
1662.04,1668.04,"Good question. Does this self-dot thing have to be different? It does not have to be, so"
1668.04,1673.2,"you can have self-dot x-val equals x-val, and self-dot y-val equals y-val. The reason I did"
1673.2,1679.16,"it here is to showcase that they actually do not have to be the same. Yeah, they are completely"
1679.16,1684.28,"different, right, so self-dot x is different than x-val. We're just happening to be assigning"
1684.28,1694.72,"this value to be whatever has passed it. Okay, so a little bit of a kind of, again, just"
1694.72,1698.64,"kind of explaining what this self is in the context of a blueprint, so if we think about"
1698.64,1703.52,"a blueprint in real life, right, so here I have a blueprint for a room that I might want"
1703.52,1708.74,"to create. I don't actually have this room created yet, right, it's just an idea. But"
1708.74,1718.0,"what I know is that I'm going to use this blueprint, right, to have a room that contains two chairs"
1718.0,1723.28,"of coffee table and a sofa, right, so in this blueprint I don't have actual rooms that I've"
1723.28,1727.8799999999999,"implemented, you know, this thing, and I don't have actual rooms where I've put two chairs"
1727.88,1735.8400000000001,of coffee table and a sofa. It's just an idea. But self is kind of the way that a blueprint
1735.8400000000001,1742.16,"accesses its attributes, right, so I've got, if I say self-dot coffee table, that means if"
1742.16,1747.7600000000002,"in the future I have an actual room, self-dot coffee table means I'm referring to that room's"
1747.76,1762.52,coffee table. So the self is a variable that we use to refer to attributes for a blueprint
1762.52,1767.96,"when I don't have actual rooms created. But once I create instances of rooms, right, so"
1767.96,1772.6,"for example here I have something called living room created, right, so I've taken my blueprint"
1772.6,1777.64,"and now somebody asked me to create a room with this blueprint, right, now I no longer use"
1777.64,1783.48,"self because I have an actual room in hand, so now I would refer to coffee table in this"
1783.48,1788.24,"living room as living room dot coffee table or living room's coffee table, right, no longer"
1788.24,1795.2,"self's coffee table. So self is only used in the context of my blueprint, okay, and to sort"
1795.2,1800.3200000000002,"of bring the last point home, the idea that with the blueprint you can create many different"
1800.3200000000002,1805.3600000000001,"instances, well here's a living room that I've applied my blueprint to and here's another"
1805.3600000000001,1808.6000000000001,"living room, completely different room that somebody asked me to use my blueprint for"
1808.6000000000001,1813.6000000000001,"to create it, different chairs, different coffee tables, different colored, you know, things."
1813.6000000000001,1818.3200000000002,"These are all different instances that I use my one template, my one blueprint for the"
1818.3200000000002,1824.92,"room on. So when we're defining the class we don't have actual objects, right, again that's"
1824.92,1829.2800000000002,"just kind of a really big idea here, we're just telling Python I'd like to create this object"
1829.2800000000002,1833.3200000000002,and this is what it looks like. I'm bundling this data with these behaviors together but
1833.32,1839.4399999999998,I don't have actual objects of this type created yet. So let's actually create some objects.
1839.4399999999998,1847.6,"The code that does this is as follows, so I've put the definition for my class, the constructor,"
1847.6,1852.34,the init method for my class up here just to remind us what it looks like. And with that
1852.34,1857.52,code we can now start to create actual objects that we can manipulate. So when we created something
1857.52,1863.24,"like, you know, L is equal to one square bracket list, one comma two, now I'm creating these"
1863.24,1868.52,actual coordinates in my code using my blueprint. So the way we do that is we invoke the name
1868.52,1874.68,"of our class. So you say coordinate, that's what we named it, right, that's our data type."
1874.68,1881.48,And here I'm passing in every single parameter except for self. So I initialized a coordinate
1881.48,1888.44,object using x val and y val. So I need to put in two parameters here for x val and y val.
1888.44,1895.92,"And self actually becomes this thing that I just created, this object. So coordinate three"
1895.92,1903.44,"comma four is now an object that's being referenced by variable named C, which is why I'm"
1903.44,1909.68,"not passing in self. So it's kind of weird to think about. But now I have one object in memory,"
1909.68,1914.68,"which is referenced by name C. And on the next line I have another object in memory, right?"
1914.68,1920.68,"Again, I've invoked the name of my class coordinate. This particular object, x value will be zero and y value"
1920.68,1926.68,will be zero. So different than the one I just did on the previous line. But they'll have the same
1926.68,1932.68,"structure, right? So they will both have some x and y value. They'll just be different from each other."
1932.68,1937.68,But they'll both have x and they'll both have y. The one I've named down here is going to be
1937.68,1944.68,"a coordinate object. So I've got two objects of type coordinate. One is referenced by C, by name C, and the other one is"
1944.68,1952.68,"referenced by name origin. So now that I have these objects in hand, I can access any of their attributes. And python will"
1952.68,1961.68,"grab for me the attribute of that particular object. So here I've got this thing called dawn notation, which we've seen before."
1961.68,1972.68,I'll explain it again in a couple slides. But the dawn notation tells python to access the x data attribute of object C.
1972.68,1983.68,"So this will grab for me the x value of C, three, right? And the next line will grab for me the x value of origin, zero."
1983.68,1993.68,"And this is all made possible because x, and we could also access y, x and y were defined in the class definition using self dot."
1993.68,2001.68,"If I didn't use self dot, those would just be variables. And as soon as I created my object, they would have gone away because that function had terminated."
2001.68,2010.68,"But in order to have these variables x and y persist throughout the lifetime of my object, I've defined them using self dot x and self dot y."
2010.68,2020.68,"So any object I've created that's of type coordinate will have some value for x and some value for y, right? So we can access that value through this notation."
2020.68,2026.68,Does that make sense so far? Is that all right?
2026.68,2036.68,"So we're going to visualize this in a slightly different way. So the exact same code as on a previous slide, we're now going to do it in our little memory type."
2036.68,2046.68,"So here I have C is equal to coordinate three, four exactly what I had on the previous slide. So in memory, the way you think about it is, you know, as we've been thinking about other objects."
2046.68,2058.6800000000003,"So it's not much different. We have C is our name, right? And it's bound to an object of type coordinate. It just so happens, we define this object, but it's the same idea. I've got a name bound to some object."
2058.68,2076.68,"And this object has its own x value and its own y value. So when you evaluate c dot x, Python goes into memory, it says, hey, what type is c? And it says, oh, it's a coordinate object. Does coordinate object have a data attribute named x? Yes, it does because it looks at the init."
2076.68,2082.68,"And then it says, well, what's its value? It's three. And so it just returns that."
2082.68,2103.68,"And so the next three lines here are slightly different from two slides ago, but very similar. A is equal to zero creates for me a variable named a bound to the value zero, right? Just to showcase that it's exactly the same as having a variable named c bound to this object that we created."
2104.68,2118.68,"And then when I say, or rig equals coordinate a comma a Python says, all right, well, here's a name, or rig or origin? What is it bound to? Well, it's also bound to an object of type coordinate."
2118.68,2130.68,And it's an object we define. So we define an object of type coordinate having an x and y value. So here they are. And they're originally zero. There's set to zero when I created this object.
2130.68,2147.68,"So when I say or rig dot x Python will look up a rig. It's going to say, hey, what type are you? Oh, you're a coordinate. Do you have an x value? You do? That's what we define in the init. Let me grab that value from you."
2147.68,2163.68,"So we're just manipulating objects in memory, right? Now that we've written the code to work with objects that we created, we're just creating a whole bunch of these objects in memory, and then, you know, grabbing the x values, and then we're going to get distance between two objects in a bit."
2163.68,2177.68,One more way to kind of show you that exact same code is to visualize it. So here is the code all the entire code as you would have it in a file.
2177.68,2190.68,So you would have all this altogether. The gray box is the definition for my object type. And the blue box is me using this object that I just created.
2190.68,2200.68,"I've just separated that out just for clarity. So when I have my gray box, there's nothing to display, right? It just sits in memory."
2200.68,2208.68,"And Python knows of this type of class coordinate that has two data attributes, the things that I've defined using self dot, right, x and y."
2208.68,2224.68,"When I create c is equal to coordinate 3, 4, right, visualizing what we're trying to do here. Here I've got this object whose name is c, and it's at 3, 4. And then I've got this object named the origin, and it's x and y values are 0, 0."
2224.68,2237.68,"So because I've created these objects using the same blueprint, right, the coordinate blueprint that I've defined up in the gray, that means every object that I've created c and origin has a self dot x and self dot y value."
2237.68,2245.68,It just so happens that the actual values for x and y are different between these two objects.
2245.68,2255.68,"So when I grab origin dot x, I'm looking up origin, and I'm grabbing its x value 0, right, just another way to visualize it."
2255.68,2263.68,"Okay, is everyone okay with these data attributes? All right. So now let's add a method."
2263.68,2280.68,"All right, so a method, remember, is just a function that works with an object of this type. Okay, so the way that we tell Python we'd like to create a method is by passing in self as the first parameter."
2280.68,2294.68,"So let's create this function named distance. If you look in the actual Python code for today, I've got two more functions, one to get the x value of this current object and one to get the y value."
2294.68,2299.68,But those are not as interesting. This distance one is interesting.
2299.68,2308.68,So I would like to create this function that only works with an object of type coordinate. So what we've done so far is these lines up here.
2308.68,2323.68,"Now we've got df again, it's just a function. So we've got deaf name of it distance and then the parameters. So again, since this is a function that only works with an object of type coordinate, I need to put self as the first parameter."
2323.68,2338.68,"And this self will help us refer to the object when I call the method on it. So if self is the first parameter, that means that this distance method will be called on self."
2338.68,2350.68,"So when I have an actual object in hand, that I'm calling distance on the self parameter will take on the value that is that object. We're going to see this in the next slide."
2350.68,2367.68,"So self is the thing that I'm calling this function on. And then what other parameters do I want to give to this function? Well, I want to find the distance between myself, so this object that I'm going to call distance on, and another coordinate object."
2367.68,2385.68,"Now, other than maybe a doc string here that says, hey, warning, other should be an object of type coordinate. There isn't really anything that enforces the type of other when you make a function call or you make a method call."
2385.68,2399.68,"So you can call this distance method with other being an integer, which is not an object of type coordinate. The code will run but will immediately crash because of what's going on inside."
2399.68,2406.68,So the only way this code will work is if you're calling it on an object of type coordinate for the other.
2406.68,2425.68,"So the reason for that is because, well, when we think about grabbing the distance between two objects that are coordinates in a 2D plane, we take the difference between the x values, square that, take the difference between the y values, square that, right, Pythagoras, add those two together, take the square root."
2425.68,2439.68,"So if I'm calling this distance method on an object of type coordinate, i.e. self, how do I grab myself's x value? Well, I just say self.x, right, my x value. What is it?"
2439.68,2452.68,"And then I would like to subtract that from the other coordinate object's x value. What's my other coordinate object? It's the thing that I'm passing in as a parameter, so grab their x value."
2452.68,2469.68,"If I take self.x minus other.x, Python will grab my x value, subtract it from others x value, square that. We do the exact same thing with y, right, grab my x, y value, subtract it from others y value, square that, and then the rest is just Pythagoras."
2469.68,2474.68,Add those two and take the square root. I take it to the power of a half.
2474.68,2493.68,"The function is just a regular function other than this self being the first parameter and us working with data attributes of myself and potentially other parameters, but you can see it returns a value, it has the df, an aim, and things like that."
2493.68,2508.68,"The way we're going to use this method that we just wrote is using the dot operator, just like we accessed a data attribute of an object that I created, I can access a procedural attribute, i.e. a method of an object I just created."
2508.68,2526.68,"So we use the dot operator for this. The thing before the dot is the object I would like to call the method on, dot, the name of the method I'd like to call, and in parentheses it's just a function, so I need to give it any parameters this method expects."
2526.68,2543.68,"Now this should look very familiar. We introduced dot notation when we worked with lists, remember that. And I said when we worked with a list, for now I have to remember why we used this special way of writing this function, but it was the same idea."
2543.68,2557.68,"The thing before the dot was the list I wanted to apply the function to, so my list is the name of a list variable, I wanted to apply the function append, and it happened to take an integer as a parameter."
2557.68,2564.68,"Same with sort here is also another one, but this one didn't take any parameters, but it's the same idea of the dot notation."
2564.68,2576.68,"In terms of our plus, here I've got two corded objects, and I've got a dot notation being used here to find the distance between one object and another one."
2576.68,2591.68,"So the thing before the dot is an object I would like to use the distance method on, pick one of them, c, dot distance, the name of the method I'd like to call, and in parentheses I've got another corded object, or rig."
2591.68,2606.68,"So here I am using the class, and I've got actual values, actual objects that I'm manipulating, c, and or rig."
2606.68,2625.68,"So this might look a little bit weird, but when we actually call the function remember we omitted self when we omitted, sorry, we omitted self when we made this function call, but that's because self implicitly becomes the thing before the dot, the thing you're calling this method on."
2625.68,2634.68,"So let's visualize that in our memory, so here I've got my class definition for a coordinate, it has some data attributes and some procedural attributes."
2634.68,2647.68,"I've got these two objects being created, c is this object of type coordinate, or rig is this object of type coordinate, they've got different x and y values, but they both have x and y, some x and y values."
2647.68,2674.68,"When I make a function call, sorry, a method call on c, Python says all right, let me look at this thing before the dot, what is it, it's an object of type coordinate, then it looks at the method you're trying to call distance, it says hey does coordinate have a distance method defined, why yes it does we just wrote it."
2674.68,2688.68,"And then it says all right well let me call this distance method, it's going to set self as c, the thing before the dot, and any other parameters will be set in order to whatever is being passed in here."
2688.68,2699.68,So or rig will become the other parameter from my definition for that function.
