Start Time,End Time,Text
0.0,18.6,"All right, let's get started."
18.6,24.92,"So today we're going to be starting a completely new set of topics, and we'll be talking about"
24.92,29.92,"these topics for the next four lectures, and it's a big topic."
29.92,35.400000000000006,The big idea we're trying to accomplish in these next four lectures is for us to start defining
35.400000000000006,39.24,our own object types.
39.24,46.44,And we'll be defining these object types through these things called Python classes.
46.44,53.64,So today's lecture will just define a really simple object type and then we'll build up
53.64,55.120000000000005,from there on.
55.120000000000005,61.60000000000001,"So let's take a step back and think about particular objects, like really specific objects that"
61.60000000000001,63.24000000000001,we've been working with.
63.24000000000001,69.2,"So for example, we've been working with probably the number 1,234, we've been working with"
69.2,76.56,"the float pi 3.14159, we've been working with sequences of characters like HLO with lists"
76.56,77.56,"of numbers, right?"
77.56,82.52000000000001,"So here's a list with those specific elements within it, and we've been working with dictionaries."
82.52,87.44,And here's a specific dictionary with these entries.
87.44,91.8,"Now every one of these things up here is an object, right?"
91.8,96.24,"We have it in our program, we can manipulate it, we can add it to other things, we can"
96.24,98.28,"index, we can do all these things."
98.28,102.6,"But every one of these objects is basically has a certain type, right?"
102.6,108.44,We talked about this back in lecture 1 when I introduced types of objects.
108.44,109.8,So what does that mean?
109.8,115.32,Well in that lecture I said that the type of an object basically tells us the kinds of
115.32,116.92,"things that we can do with it, right?"
116.92,120.64,So the things you can do with a number are going to be different than the kinds of things
120.64,121.75999999999999,you can do with strings.
121.75999999999999,126.4,And we've been seeing this since that lecture up until today.
126.4,129.4,Today we're going to see how we can create our own object types.
129.4,134.16,"So to do that we have to understand the following thing, and this is something I'll keep repeating"
134.16,135.16,today.
135.52,140.32,"Decide to create an object type, or every one of these objects for example, has been created"
140.32,142.92,"using some blueprint, right?"
142.92,145.88,And when you're creating these objects you need to think about two things.
145.88,150.64,"The first is what data will represent this object, and the second is what behaviors will"
150.64,152.32,this object have.
152.32,155.32,"Now the objects up here are pretty simple, right?"
155.32,160.64,"The kinds of data that represents this integer is, well there's no data really, it's just"
160.64,162.16,the number itself.
162.56,166.0,"It has some operations, some things that you can do with this integer."
166.0,171.68,Now the data that represents a list is going to be different than the data that represents
171.68,178.16,"an integer, because a list is kind of made up of a sequence of numbers or objects."
178.16,182.07999999999998,And then the data that makes up a dictionary is completely different than the data that
182.07999999999998,186.32,"makes up the list, because a dictionary has entries, where each entry has a key and a value"
186.32,189.68,"pair, and then you have a bunch of these entries, right?"
189.68,193.48000000000002,"So the data representing each one of these objects is different, and we're going to decide"
193.48000000000002,197.28,what data represents the new objects that we want to create.
197.28,201.28,"And of course this is something we've known from the first lecture, the kinds of ways that"
201.28,205.08,we can interact with these objects is also different amongst all these different object
205.08,206.56,"types, right?"
206.56,213.16,"So in terms of terminology, when we create an actual object that we want to manipulate, we"
213.16,215.88,call it an instance of a type.
215.88,223.16,"So this specific number, 1,234, is an instance of an integer, and this specific sequence of"
223.16,229.48,"characters, lowercase h, l, l, o, is an instance of a string, all right."
229.48,235.07999999999998,So the idea of object-oriented programming is basically that everything in Python is an
235.07999999999998,239.68,"object, and this we've talked about when we were introducing functions, we treated functions"
239.68,241.51999999999998,like objects.
241.52,246.92000000000002,"And what that means is that we can create new objects that have some type, so we actually"
246.92000000000002,252.12,"create these very specific objects that we can manipulate, and we can also destroy the"
252.12,253.12,"objects, right?"
253.12,255.72,"So you can create them, manipulate them, and destroy them as you will."
255.72,258.92,But each one of these objects has a specific type.
258.92,263.48,So let's talk a little bit more about the data abstraction.
263.48,269.16,"So once you have an object that you'd like to create, so think of anything in the world,"
269.16,275.64000000000004,"some something, the two things that you need to think about are what is going to be the"
275.64000000000004,279.84000000000003,"way that you represent the object in terms of data, right?"
279.84000000000003,283.20000000000005,And the other thing is what are the behaviors of this object?
283.20000000000005,289.12,How can other programmers or other objects interact with this thing that you're creating?
289.12,294.12,"So when we're creating our own object type, we have to think about these data abstractions,"
294.12,295.12,okay?
295.12,297.12,So let's take a more sort of real life example.
297.12,302.48,So let's say I have these two very specific cars that actually exist in the real world.
302.48,306.56,"So we can actually drive these cars around, we can manipulate them, right?"
306.56,310.72,"They have already been created, they are actual objects, right?"
310.72,316.12,"Well behind the scenes, these objects were created using some blueprint, right?"
316.12,322.4,"This blueprint is not an actual tangible thing, it's basically some abstract notion of how"
322.40000000000003,327.36,"to create those specific objects, those specific cars."
327.36,332.64000000000004,"So as we're thinking about creating our own object types, we have to think about design"
332.64000000000004,334.24,"decisions, right?"
334.24,338.28000000000003,If I want to create a blueprint for a car that somebody can then use to create an actual
338.28000000000003,342.52000000000004,"car in real life, how do I abstract the car?"
342.52000000000004,346.72,"And as we're creating these objects ourselves, we get to make these design decisions, which"
346.72,348.08000000000004,is pretty cool.
348.08000000000004,352.16,"So if I were creating this car, right, the blueprint for a car, I would say, well, I'm going"
352.16,356.0,"to use maybe the length of the car, the width of the car, and the height of the car, and"
356.0,357.52000000000004,the color of the car.
357.52000000000004,362.56,And those four data attributes will represent a car object.
362.56,364.56,"But of course that's my design decision, right?"
364.56,368.96000000000004,If you are more familiar with cars or if you wanted to get into a more detailed description
368.96000000000004,375.56,"or representation, you would also have a number for how many horsepower it has, how many"
375.56,380.08000000000004,"doors it has, maybe how many people could fit, you know, other things like that."
380.08,387.03999999999996,"But a very simple data abstraction for a car is linked with height and color, right?"
387.03999999999996,391.44,"So that's data abstract, so what data represents this object you're trying to create?"
391.44,392.76,Now how about the interface?
392.76,397.76,"Well, in terms of the interface, we decide what are some ways that programmers can interact"
397.76,401.59999999999997,with the object or other objects can interact with this object.
401.59999999999997,407.79999999999995,"So we could say that we could let the users change the color of the car, right?"
407.8,413.44,"We could say that we can let the car, you know, make a noise, so honk the horn, could"
413.44,417.8,"be maybe one thing, one function that this car could do."
417.8,422.0,"And if we say honk the horn, then maybe you would print something to the screen, right?"
422.0,423.0,Something like that.
423.0,426.88,"And then we can have the car drive from point A to point B, or we could have the car, you"
426.88,432.64,"know, go in a circle, you could have the car crash on other car, and all of these behaviors"
432.64,439.71999999999997,will are part of this interface for this particular car.
439.71999999999997,444.08,"But we're going to define them such that any car that we create from here on, any actual"
444.08,449.4,"object that we create, we'll have all of these behaviors and all of these data attributes."
449.4,453.44,"So an example a little closer to home is the list, right?"
453.44,456.03999999999996,We've been working with lists so far.
456.03999999999996,461.52,"So behind the scenes, somebody created the data type list, right?"
461.52,466.15999999999997,"So there's some code in Python that basically defines the data that makes up the list, the"
466.15999999999997,469.84,"data attributes, how is a list described?"
469.84,475.12,"And the behaviors, the procedures, the functions that a list can do, right?"
475.12,479.71999999999997,"So in terms of data attributes, well, there's many design decisions that, you know, whoever"
479.71999999999997,483.28,"decided to create this list class could have done, how could they have represented the"
483.28,484.28,list?
484.28,488.91999999999996,"Well, they could have said, I'm going to allocate sort of a continuous block of memory,"
488.92,492.04,"where and your elements will go in that order, right?"
492.04,497.36,"From the smallest memory of value to the biggest memory value, that's one design decision."
497.36,501.88,"Another one could be that instead of allocating sort of a continuous block of memory, you could"
501.88,505.52000000000004,"say, I can allocate memories here and there, that's okay."
505.52000000000004,512.72,"But then each element in my list will then be represented by two things, the first being"
512.72,517.44,"the value at that location, and the second could be maybe another integer or something that"
517.44,523.24,tells Python which memory location to go to to get the next element in the list.
523.24,528.7600000000001,"So both valid design decisions, I think Python did the second one, right?"
528.7600000000001,533.24,"So those are, that's how you represent the data that represents the list."
533.24,536.8800000000001,"And in terms of behaviors, well, we've already been working with lists, so we know a bunch of"
536.8800000000001,538.9200000000001,"the behaviors that lists have, right?"
538.9200000000001,542.7600000000001,"You can index into it, you can sort a list, you can append an item to the end of the list,"
542.76,548.0,"you can get the maximum element within the list, all of these different procedures, functions"
548.0,549.84,"are things that you can do with lists, right?"
549.84,551.36,And we've been working with them.
551.36,555.84,"And we've been working with lists without actually knowing the representation, how somebody"
555.84,560.4,"decided to represent this class, which is pretty cool."
560.4,562.56,"So a couple more real life examples, right?"
562.56,566.56,"If we were to think about representing, you know, one of the, each of these."
566.56,569.4399999999999,"So if we think about the object and elevator, right?"
569.44,572.48,"Again, it's up to us to make the design decision."
572.48,574.96,"It's basically a box that can change floors, right?"
574.96,578.2800000000001,So we could represent it using the length with the height.
578.2800000000001,581.72,"Maybe we could also represent, which are all, you know, floats or something like that."
581.72,587.1600000000001,We can also represent it using the max capacity and the current floor it's at.
587.1600000000001,594.9200000000001,"So all five of these variables, you know, together, values together, represent my elevator,"
594.9200000000001,595.9200000000001,right?
595.9200000000001,598.96,"And again, it's my design decision to do this, yours might be different."
598.96,604.1600000000001,"In terms of things that the elevator can do, well, we can change its current floor, which"
604.1600000000001,608.08,"is basically saying, you know, change the value of the variable current floor to be something"
608.08,609.48,else.
609.48,613.8000000000001,"Add people to it, maybe checking if you're at max capacity or not and maybe printing out"
613.8000000000001,617.96,"a warning if you're above that, removing people, things like that."
617.96,624.36,An employee is also a pretty common example of something that's typically implemented in
624.36,625.76,a bunch of programming languages.
625.76,629.16,"So an employee, basically a person that has a salary, right?"
629.16,631.04,Maybe works for company X.
631.04,634.28,"So you could represent this employee using their name, right?"
634.28,638.84,"Maybe a string for the first name, a string for the last name, and then their birthday, maybe,"
638.84,643.4,"and then their salary, which is, you know, a float or something like that."
643.4,647.0,"And in terms of behavior is what can employees do, where you can change their name, you can"
647.0,651.08,"change their salary, you can maybe activate or deactivate them as current employees, things"
651.08,652.08,like that.
652.08,658.0400000000001,"A queue at a store, also a really nice example, and it kind of goes hand in hand with stack"
658.0400000000001,660.08,of pancakes.
660.08,662.08,How would you represent a queue at a store?
662.08,666.48,"Well, the representation isn't going to be a set of things."
666.48,672.76,"The representation could be something really simple, like just a list, right?"
672.76,673.76,Which is fine.
673.76,677.84,"So maybe the list will have, you know, some strings with the names of the people who are currently"
677.84,680.32,in the queue at a store.
680.32,687.1600000000001,"But what's going to make a queue kind of special is the way that we'll be using it, right?"
687.1600000000001,691.6800000000001,"So the representation isn't super unique, it's just a list."
691.6800000000001,697.08,"But the way that a queue operates will be special, because if you think about the queue, the first"
697.08,700.9200000000001,"person who comes into the queue will be the first person out of the queue, right?"
700.9200000000001,703.7600000000001,"A first in, first out kind of situation."
703.7600000000001,708.36,"So that means if you make the design decision to add new people at the end of the queue, right?"
708.36,714.96,"So if I have a new person that gets added here, they're the newest person in."
714.96,718.6800000000001,"That means if I'm removing a person from the queue, I better remove the oldest one, which"
718.6800000000001,722.84,"is going to be over at the beginning of my list, right?"
722.84,728.4,"So the way that you use the queue will be consistent with this idea, and then you can basically"
728.4,729.6,simulate the queue.
729.6,734.6800000000001,And the stack of pancakes is very similar if you think about pancakes.
734.6800000000001,737.88,"The first one you made is the last one you eat, right?"
737.88,741.16,"So it's a first in, last out of a kind of situation."
741.16,749.24,"So that means that we can still represent a stack of pancakes using a list, right?"
749.24,754.64,"So the representation, the data representation for a stack of pancakes will be the same as"
754.64,758.36,"a queue, except that the behavior will be different, right?"
758.36,763.08,"Because if I just made a new pancake and it goes at the end here, right?"
763.08,766.8,The newest one that I made is the first one that I'm going to eat.
766.8000000000001,771.4000000000001,"So if I add a pancake to the end of my list, I'm going to remove the pancake that I want"
771.4000000000001,775.5200000000001,to eat from the end of my list as well.
775.5200000000001,776.5200000000001,Okay.
776.5200000000001,780.2800000000001,So the idea of object-oriented programming and the reason we're doing this is because now we're
780.2800000000001,785.2400000000001,bundling basically data and behaviors into one thing.
785.2400000000001,792.48,And so we can create all of these objects that have the same type that all are going to function
792.48,793.48,in the same way.
793.48,795.96,"We know they're going to be consistent, right?"
796.12,800.2,They're going to be consistent in the data that represents them and consistent in the way
800.2,801.6,"that we use them, right?"
801.6,809.4000000000001,"So we know for sure that the queue is going to be a first out kind of situation, right?"
809.4000000000001,813.48,And the way we're going to implement this is using these things called Python classes.
813.48,818.52,And the reason we create these Python classes is to make code that's very nicely reusable.
818.52,821.9200000000001,We can create really simple Python classes that we'll see today.
821.9200000000001,826.96,"And then we can build upon these Python classes to create more complex classes, which we'll see"
826.96,828.2800000000001,on Wednesday.
828.2800000000001,833.3600000000001,"But the big idea here, and this is something that I was a little bit confused about when"
833.3600000000001,838.48,"I first started learning about object-oriented programming, is you get to be in charge of"
838.48,840.5200000000001,"the design decision, right?"
840.5200000000001,845.4000000000001,So you get to decide what data represents the class and you decide what behaviors represent
845.4000000000001,846.6,the class.
846.6,851.88,"So if you wanted to say that you represent a queue using a list, right?"
851.88,856.44,"First in first out, if you add items to the end, you remove items from the beginning."
856.44,858.12,That's one design decision.
858.12,862.24,"Another design decision could be, well, you still represent it as a list, but new items get"
862.24,864.32,added to the front.
864.32,868.0400000000001,"But to be consistent with the idea of a queue, that means you remove items from the back."
868.0400000000001,870.8000000000001,"And then the behavior is the same, right?"
870.8000000000001,875.8000000000001,"We're implementing a queue, no matter which one of those design decisions we've made."
876.8000000000001,877.8000000000001,Okay.
877.8000000000001,882.4000000000001,"So as we're going through today's lecture, I want to make a note of a couple things."
882.4000000000001,886.6400000000001,So I've got these little tabs up at the top here.
886.6400000000001,890.2800000000001,We're going to be basically switching our brains a little bit today.
890.2800000000001,895.2400000000001,"We're going to be defining a Python object, right?"
895.2400000000001,899.32,"So we're going to be writing code that tells Python, hey, I am telling you, I would like"
899.32,902.8800000000001,to create this object type.
902.88,907.64,"And these are the data, these are the, this is the data that represents them, represents"
907.64,909.76,"it, and these are the behaviors that represent it."
909.76,912.24,So that's us implementing the class.
912.24,916.84,"So telling Python that we are now creating and telling you what, what, what an object of this"
916.84,918.72,type is and does.
918.72,924.4,"And the other thing is, once we have a definition for this object type, we're going to actually"
924.4,926.8,"use the type, right?"
926.8,930.92,We're going to create new objects of this type.
930.9200000000001,936.0000000000001,"So when we're creating the class, when we're telling Python that's an object like this exists,"
936.0000000000001,941.2,"we're deciding the name of our class, we're deciding what data abstracts it, we're deciding"
941.2,943.6400000000001,"what behaviors we can do with it, right?"
943.6400000000001,948.4000000000001,"So if you think about the list, we haven't actually seen the code to do this, but someone"
948.4000000000001,952.44,wrote code to define this list class.
952.44,957.6800000000001,"Now using the class means that we're assuming that this code already exists, right?"
957.6800000000001,960.8800000000001,And you're just creating a whole bunch of objects of this type.
960.88,962.68,"So we've been doing this definitely, right?"
962.68,966.64,"If we think about the list class again, here, you know, for example, we created an actual"
966.64,968.64,"object that we can manipulate, right?"
968.64,970.6,L is equal to 1 comma 2.
970.6,975.32,"We've also created L is equal to 3 comma 4 comma 5 and all these things, right?"
975.32,979.8,We're basically creating these instances that we can manipulate and use in our program to
979.8,981.92,"achieve something useful, right?"
981.92,986.2,"And today, we're going to see how we can do both of those things."
986.2,990.56,"I want to draw a little parallel with functions because it's going to feel very similar, right?"
990.5600000000001,997.36,"And with functions, when we were defining a function, we were telling Python that I would"
997.36,1005.5200000000001,"like to abstract some code that does something useful using this function definition, right?"
1005.5200000000001,1010.12,So we were writing the definition for the function in this abstract way.
1010.12,1012.84,"We didn't actually run the function at that point, right?"
1012.84,1014.4000000000001,We just defined it.
1014.4000000000001,1017.48,"And so when we define a class, that's basically what we're doing."
1017.48,1025.08,We're telling Python that we're creating this object that bundles data and behaviors together.
1025.08,1031.48,"When we create instances of this data type that we're going to define, that's kind of like"
1031.48,1036.1200000000001,"we called the actual function that we defined, right?"
1036.1200000000001,1041.52,"So when we called the function, we were now doing something useful in our program, right?"
1041.52,1045.1200000000001,"We said, here are some actual parameters I want you to run this function with."
1045.1200000000001,1047.64,"Now, tell me what the output is, okay?"
1047.64,1052.2800000000002,And that's exactly what we're going to do when we create instances of the data type we're
1052.2800000000002,1053.68,defining.
1053.68,1061.68,"We're now creating actual objects that we can manipulate and use in our class, okay?"
1061.68,1068.5200000000002,"So the object we're going to create in today's lecture is a coordinate in a 2D plane, okay?"
1068.5200000000002,1070.4,"Pretty simple, pretty mathematical."
1070.4,1075.8000000000002,"So before we actually write the code, let's kind of think about what it actually means"
1075.8000000000002,1078.3200000000002,to put a coordinate in a 2D plane.
1078.3200000000002,1081.2800000000002,"So we're going to think about if we had a bunch of instances, right?"
1081.2800000000002,1084.7800000000002,"If we had a bunch of coordinates in a 2D plane, what do they look like?"
1084.7800000000002,1088.2,What kind of data are we interested in grabbing from these instances?
1088.2,1090.2,What are some things we can do with it?
1090.2,1094.48,So here I have a point in my 2D plane.
1094.48,1102.16,"So if we think about how we look at this coordinate, well, we know how far away the coordinate"
1102.16,1108.08,"is on the x-axis, and we know how far away the coordinate is on the y-axis, right?"
1108.08,1111.44,So that's one instance of a coordinate object.
1111.44,1113.76,"Now let's say we had another one, right?"
1113.76,1115.6,Here's another dot in my 2D plane.
1115.6,1120.44,"Again, this dot will also know how far away it is on the x-axis, and how far away it"
1120.44,1123.32,"is on the y-axis, okay?"
1123.32,1133.6,"So one reasonable data abstraction for a coordinate in a 2D plane could be to say I want two numbers,"
1133.6,1139.36,"one representing how far away it is on the x-axis, and one for how far away it is on the y-axis,"
1139.36,1140.36,right?
1140.36,1141.36,That seems pretty reasonable.
1141.36,1143.36,"I don't care about color, right?"
1143.36,1148.8,"Even though I colored these things, but you can imagine making a cuter version of this"
1148.8,1153.36,"coordinate object that also has a color associated with it, okay?"
1153.36,1157.56,So the data that will represent my point in a coordinate plane and a 2D coordinate plane
1157.56,1160.2,"is just two numbers, right?"
1160.2,1163.0,"One for the x, one for the y."
1163.0,1165.48,Now what are some things that we can do with these coordinate objects?
1165.48,1171.72,"Certainly something really simple we can do is to say, well, point, you know, one of these"
1171.72,1177.0,"points, you know, the orange one, for example, tell me how far away you are on the x-axis,"
1177.0,1179.56,"or tell me how far away you are on the y-axis, right?"
1179.56,1183.76,"So those two commands could return, you know, something like three, for that's how far away"
1183.76,1189.24,"that point is on the x-axis or four, for how far away it is on the y-axis."
1189.24,1190.68,Those are pretty simple things to do.
1190.68,1194.88,"One more interesting thing to do is to say, well, hey, you point, orange point, right over"
1194.88,1200.04,"there, can you tell me how far away you are between the green point, right?"
1200.04,1202.96,So that would be the Euclidean distance between these two points.
1202.96,1208.8400000000001,And we are going to write code that figures out how far away one coordinate object is from
1208.8400000000001,1210.72,another coordinate object.
1210.72,1215.8,"All right, so let's start defining this class coordinate."
